<?xml version="1.0" encoding="UTF-8"?>
<c:Catalogue xmlns:c="http://www.eclipse.org/webtools/Catalogue" xmlns:xsi="http://www.w3.org/2001/XMLSchema-instance" xsi:schemaLocation="http://www.eclipse.org/webtools/Catalogue Catalogue.xsd ">
	<c:Book>
		<title>Professional XML Schema</title>
		<date>2001</date>
		<isbn>1-861005-47-4</isbn>
		<publisher>Wrox Press</publisher>
	</c:Book>
	<c:Magazine>
		<title>WebSphere Developer's Journal</title>
		<date>2001</date>
	</c:Magazine>
	<c:Book>
		<title>Java and XSLT</title>
		<date>2001</date>
		<isbn>0-596-00143-6</isbn>
		<publisher>O'Reilly</publisher>
	</c:Book>
</c:Catalogue>
